{"$schema":"https://json-schema.org/draft/2020-12/schema","type":"object","required":["schema_version","channel_convention","units","content_hash"],"properties":{"schema_version":{"const":"wge.channel_unit_plan.v1"},"channel_convention":{"const":"zero_based_0_7"},"units":{"type":"array","minItems":1},"content_hash":{"type":"string","pattern":"^[0-9a-f]{64}$"}}}
