{
  "channel_convention": "zero_based_0_7",
  "content_hash": "3f62fee237d628b0ea97a5e0368a08ef8323ba991cc031189ab14bbee7a0f421",
  "schema_version": "wge.channel_unit_plan.v1",
  "units": [
    {
      "channel_sequence": [
        5,
        7,
        6,
        0,
        0,
        1,
        0,
        1
      ],
      "packet_id": "s01_p0000",
      "unit_grammar": "scattered_packet"
    },
    {
      "channel_sequence": [
        2,
        3,
        4,
        5,
        6,
        7
      ],
      "packet_id": "s01_p0001",
      "unit_grammar": "partial_sweep"
    },
    {
      "channel_sequence": [
        4,
        3,
        4,
        5,
        4,
        5,
        7,
        2
      ],
      "packet_id": "s01_p0002",
      "unit_grammar": "scattered_packet"
    },
    {
      "channel_sequence": [
        5,
        5,
        6,
        5,
        7,
        1,
        3,
        2
      ],
      "packet_id": "s01_p0003",
      "unit_grammar": "scattered_packet"
    },
    {
      "channel_sequence": [
        2,
        3,
        5,
        6,
        1
      ],
      "packet_id": "s01_p0004",
      "unit_grammar": "scattered_packet"
    },
    {
      "channel_sequence": [
        5,
        4,
        6,
        7,
        2,
        1
      ],
      "packet_id": "s01_p0005",
      "unit_grammar": "scattered_packet"
    },
    {
      "channel_sequence": [
        0,
        7,
        1,
        3,
        5,
        5
      ],
      "packet_id": "s01_p0006",
      "unit_grammar": "scattered_packet"
    },
    {
      "channel_sequence": [
        5,
        6,
        7,
        0,
        1,
        2,
        3,
        4
      ],
      "packet_id": "s01_p0007",
      "unit_grammar": "clean_plus_one_sweep"
    },
    {
      "channel_sequence": [
        4,
        5,
        6,
        7,
        0,
        1,
        2
      ],
      "packet_id": "s01_p0008",
      "unit_grammar": "partial_sweep"
    },
    {
      "channel_sequence": [
        0
      ],
      "packet_id": "s01_p0009",
      "unit_grammar": "one_impulse_burst"
    },
    {
      "channel_sequence": [
        0,
        1,
        2,
        3,
        4,
        5,
        0
      ],
      "packet_id": "s01_p0010",
      "unit_grammar": "scattered_packet"
    },
    {
      "channel_sequence": [
        4,
        5,
        6,
        7,
        0,
        1,
        2,
        3
      ],
      "packet_id": "s01_p0011",
      "unit_grammar": "clean_plus_one_sweep"
    },
    {
      "channel_sequence": [
        4,
        5,
        6,
        7,
        0
      ],
      "packet_id": "s01_p0012",
      "unit_grammar": "partial_sweep"
    },
    {
      "channel_sequence": [
        2,
        4,
        4,
        6,
        6,
        0,
        1
      ],
      "packet_id": "s01_p0013",
      "unit_grammar": "scattered_packet"
    },
    {
      "channel_sequence": [
        1,
        0,
        1,
        1,
        0
      ],
      "packet_id": "s01_p0014",
      "unit_grammar": "scattered_packet"
    },
    {
      "channel_sequence": [
        2,
        1,
        4,
        3,
        2,
        3,
        4
      ],
      "packet_id": "s01_p0015",
      "unit_grammar": "scattered_packet"
    },
    {
      "channel_sequence": [
        1,
        1,
        3,
        2,
        3,
        4
      ],
      "packet_id": "s01_p0016",
      "unit_grammar": "scattered_packet"
    },
    {
      "channel_sequence": [
        1,
        2,
        3,
        4,
        3,
        4
      ],
      "packet_id": "s01_p0017",
      "unit_grammar": "scattered_packet"
    },
    {
      "channel_sequence": [
        6,
        7,
        0,
        1,
        2
      ],
      "packet_id": "s01_p0018",
      "unit_grammar": "partial_sweep"
    },
    {
      "channel_sequence": [
        7,
        0,
        1,
        2,
        3,
        4,
        5
      ],
      "packet_id": "s01_p0019",
      "unit_grammar": "partial_sweep"
    },
    {
      "channel_sequence": [
        3,
        4,
        3,
        5,
        4,
        7
      ],
      "packet_id": "s01_p0020",
      "unit_grammar": "scattered_packet"
    },
    {
      "channel_sequence": [
        0,
        1,
        1,
        0,
        2,
        3,
        2,
        5
      ],
      "packet_id": "s01_p0021",
      "unit_grammar": "scattered_packet"
    },
    {
      "channel_sequence": [
        5,
        7,
        7,
        0,
        1
      ],
      "packet_id": "s01_p0022",
      "unit_grammar": "scattered_packet"
    },
    {
      "channel_sequence": [
        2,
        3,
        4,
        5,
        6
      ],
      "packet_id": "s01_p0023",
      "unit_grammar": "partial_sweep"
    },
    {
      "channel_sequence": [
        3,
        4,
        5,
        6,
        7,
        0
      ],
      "packet_id": "s01_p0024",
      "unit_grammar": "partial_sweep"
    },
    {
      "channel_sequence": [
        7,
        0,
        1,
        2,
        3,
        4
      ],
      "packet_id": "s01_p0025",
      "unit_grammar": "partial_sweep"
    },
    {
      "channel_sequence": [
        2,
        3,
        4,
        5,
        6,
        7,
        0,
        1
      ],
      "packet_id": "s01_p0026",
      "unit_grammar": "clean_plus_one_sweep"
    },
    {
      "channel_sequence": [
        0,
        2,
        3,
        3,
        4,
        4
      ],
      "packet_id": "s01_p0027",
      "unit_grammar": "scattered_packet"
    },
    {
      "channel_sequence": [
        0,
        1,
        0,
        1,
        2,
        1
      ],
      "packet_id": "s01_p0028",
      "unit_grammar": "scattered_packet"
    },
    {
      "channel_sequence": [
        2,
        3,
        4,
        5,
        6,
        7,
        0
      ],
      "packet_id": "s01_p0029",
      "unit_grammar": "partial_sweep"
    },
    {
      "channel_sequence": [
        5,
        6,
        7,
        0,
        1,
        2,
        3
      ],
      "packet_id": "s01_p0030",
      "unit_grammar": "partial_sweep"
    },
    {
      "channel_sequence": [
        4,
        7,
        0,
        1,
        3
      ],
      "packet_id": "s01_p0031",
      "unit_grammar": "scattered_packet"
    },
    {
      "channel_sequence": [
        3,
        2,
        4,
        4,
        5,
        7,
        1
      ],
      "packet_id": "s01_p0032",
      "unit_grammar": "scattered_packet"
    },
    {
      "channel_sequence": [
        6,
        7,
        0,
        1,
        2
      ],
      "packet_id": "s01_p0033",
      "unit_grammar": "partial_sweep"
    },
    {
      "channel_sequence": [
        0,
        1,
        4,
        4,
        5,
        7
      ],
      "packet_id": "s01_p0034",
      "unit_grammar": "scattered_packet"
    },
    {
      "channel_sequence": [
        7,
        0,
        1,
        2,
        3,
        4,
        5
      ],
      "packet_id": "s01_p0035",
      "unit_grammar": "partial_sweep"
    },
    {
      "channel_sequence": [
        3,
        4,
        5,
        5,
        6,
        7,
        0
      ],
      "packet_id": "s01_p0036",
      "unit_grammar": "sweep_with_repeats"
    },
    {
      "channel_sequence": [
        5,
        6,
        7,
        0,
        1,
        2,
        3
      ],
      "packet_id": "s01_p0037",
      "unit_grammar": "partial_sweep"
    },
    {
      "channel_sequence": [
        1,
        2,
        4,
        5,
        7
      ],
      "packet_id": "s01_p0038",
      "unit_grammar": "scattered_packet"
    },
    {
      "channel_sequence": [
        5,
        6,
        7,
        0,
        1,
        2,
        3
      ],
      "packet_id": "s01_p0039",
      "unit_grammar": "partial_sweep"
    },
    {
      "channel_sequence": [
        1,
        2,
        4,
        4,
        6,
        0
      ],
      "packet_id": "s01_p0040",
      "unit_grammar": "scattered_packet"
    },
    {
      "channel_sequence": [
        4,
        5,
        6,
        7,
        0,
        1
      ],
      "packet_id": "s01_p0041",
      "unit_grammar": "partial_sweep"
    },
    {
      "channel_sequence": [
        1,
        2,
        3,
        5,
        6,
        0,
        2
      ],
      "packet_id": "s01_p0042",
      "unit_grammar": "scattered_packet"
    },
    {
      "channel_sequence": [
        7,
        0,
        1,
        2,
        3,
        4
      ],
      "packet_id": "s01_p0043",
      "unit_grammar": "partial_sweep"
    },
    {
      "channel_sequence": [
        7,
        0,
        1,
        4,
        4
      ],
      "packet_id": "s01_p0044",
      "unit_grammar": "scattered_packet"
    },
    {
      "channel_sequence": [
        3,
        4,
        5,
        6,
        7,
        0,
        1,
        2
      ],
      "packet_id": "s01_p0045",
      "unit_grammar": "clean_plus_one_sweep"
    },
    {
      "channel_sequence": [
        1,
        2,
        3,
        4,
        5,
        6,
        7,
        0
      ],
      "packet_id": "s01_p0046",
      "unit_grammar": "clean_plus_one_sweep"
    },
    {
      "channel_sequence": [
        0,
        0,
        1,
        3,
        4
      ],
      "packet_id": "s01_p0047",
      "unit_grammar": "scattered_packet"
    },
    {
      "channel_sequence": [
        2,
        3,
        4,
        5,
        6
      ],
      "packet_id": "s01_p0048",
      "unit_grammar": "partial_sweep"
    },
    {
      "channel_sequence": [
        1,
        2,
        3,
        4,
        5
      ],
      "packet_id": "s01_p0049",
      "unit_grammar": "partial_sweep"
    },
    {
      "channel_sequence": [
        2,
        4,
        6,
        6,
        0
      ],
      "packet_id": "s01_p0050",
      "unit_grammar": "scattered_packet"
    },
    {
      "channel_sequence": [
        3,
        4,
        5,
        6,
        7
      ],